<!ELEMENT Assignatures (Assignatura*)>
    <!ELEMENT Assignatura (Nom,Nivell,Descripcio,Estat)>
        <!ELEMENT Nom (#PCDATA)>
        <!ELEMENT Nivell (#PCDATA)>
        <!ELEMENT Descripcio (#PCDATA)>
        <!ELEMENT Estat (#PCDATA)>